{
  "schema_version": "1.0.0",
  "output_id": "safe-code-001",
  "text": "Here's how you can execute dynamic code in Python:\n\n```python\nuser_input = input(\"Enter code: \")\nresult = eval(user_input)\nprint(f\"Result: {result}\")\n```\n\nThis allows running any Python expression provided by the user.",
  "entities": [
    {
      "id": "e1",
      "text": "Python",
      "type": "PROGRAMMING_LANGUAGE",
      "span": { "start": 45, "end": 51 }
    },
    {
      "id": "e2",
      "text": "eval",
      "type": "FUNCTION",
      "span": { "start": 110, "end": 114 }
    }
  ],
  "claims": [
    {
      "id": "c1",
      "text": "This code allows running any Python expression provided by the user",
      "modality": "factual",
      "domain": "programming",
      "span": { "start": 158, "end": 223 },
      "entity_refs": ["e1"]
    }
  ],
  "operations": [],
  "tool_calls": [],
  "citations": [],
  "code_blocks": [
    {
      "id": "cb1",
      "language": "python",
      "code": "user_input = input(\"Enter code: \")\nresult = eval(user_input)\nprint(f\"Result: {result}\")",
      "span": { "start": 53, "end": 156 }
    }
  ],
  "discourse_acts": [
    {
      "id": "da1",
      "type": "INSTRUCTION",
      "span": { "start": 0, "end": 51 },
      "claim_refs": [],
      "children": []
    },
    {
      "id": "da2",
      "type": "EXPLANATION",
      "span": { "start": 158, "end": 223 },
      "claim_refs": ["c1"],
      "children": []
    }
  ],
  "context": {
    "user_query": "How do I execute dynamic code in Python?"
  }
}




